<?xml version="1.0" encoding="UTF-8"?>
<?xml-stylesheet type="text/xsl" href="Tabla.xslt"?> 
<!-- <!DOCTYPE patients SYSTEM "Tabla.dtd" []> -->
<patients xmlns:xsi="http://www.w3.org/2001/XMLSchema-instance" xsi:noNamespaceSchemaLocation="Tabla.xsd">
    <patient id ="C8234">
        <hospital>Cruces</hospital>
        <order_id>201</order_id>
        <age>89</age>
        <diagnosis_date>2024-05-01</diagnosis_date>
        <diagnosis>Glaucoma</diagnosis>
        <image>imagenes/imagen1.jpg</image>
		<note>Glaucoma de ángulo abierto</note>
    </patient>
    <patient id="D1248">
        <hospital>Donostia</hospital>
        <order_id>393</order_id>
        <age>55</age>
        <diagnosis_date>2024-05-02</diagnosis_date>
        <diagnosis>No Glaucoma</diagnosis>
        <image>imagenes/imagen2.jpg</image>
        
    </patient>
	<patient id="D6853">
        <hospital>Donostia</hospital>
        <order_id>200</order_id>
        <age>60</age>
        <diagnosis_date>2024-04-24</diagnosis_date>
        <diagnosis>No Glaucoma</diagnosis>
        <image>imagenes/imagen3.jpg</image>
        
    </patient>
	<patient id="C2344">
        <hospital>Cruces</hospital>
        <order_id>543</order_id>
        <age>73</age>
        <diagnosis_date>2024-05-10</diagnosis_date>
        <diagnosis>Glaucoma</diagnosis>
        <image>imagenes/imagen4.jpg</image>
        <note>Glaucoma de ángulo cerrado</note>
    </patient>
		<patient id="C4906">
        <hospital>Cruces</hospital>
        <order_id>225</order_id>
        <age>58</age>
        <diagnosis_date>2023-12-30</diagnosis_date>
        <diagnosis>Glaucoma</diagnosis>
        <image>imagenes/imagen5.jpg</image>
        <note>Glaucoma de ángulo cerrado</note>
    </patient>
</patients>
